{
  "schema_version": 1,
  "reservations": [
    {
      "kind": "flight",
      "title": "Tokyo to Sapporo",
      "provider": "JAL",
      "booking_ref": "0RA5LX",
      "status": "confirmed",
      "starts_at_local": "2027-07-03T09:00:00",
      "ends_at_local": "2027-07-03T10:35:00",
      "start_place": {
        "name": "東京(羽田)",
        "address": null,
        "iata": null,
        "city": "Tokyo",
        "country": "JP"
      },
      "end_place": {
        "name": "札幌(新千歳)",
        "address": null,
        "iata": null,
        "city": "Sapporo",
        "country": "JP"
      },
      "travellers": [
        { "name": "Haruto Nakamura", "type": "adult" }
      ],
      "price": { "amount": "25970", "currency": "JPY" },
      "cancellation": "ご搭乗日の55日前まで：運賃の約5％の取消手数料がかかります。54日前から出発時刻まで：運賃の約50％の取消手数料がかかります。出発時刻以降は払い戻しできません。別途、払戻手数料440円がかかります。",
      "details": {
        "number": "JL 507",
        "carrier": "JAL",
        "from_iata": null,
        "to_iata": null,
        "seat": "23A",
        "cabin": "普通席",
        "terminal": "1",
        "gate": null,
        "legs": null
      },
      "confidence": {
        "kind": 1.0,
        "title": 1.0,
        "provider": 1.0,
        "booking_ref": 1.0,
        "status": 1.0,
        "starts_at_local": 1.0,
        "ends_at_local": 1.0,
        "start_place": 1.0,
        "end_place": 1.0,
        "travellers": 1.0,
        "price": 1.0,
        "cancellation": 1.0,
        "details": 1.0
      }
    }
  ],
  "trip_hint": {
    "destination": "Sapporo",
    "country": "JP",
    "starts_on": "2027-07-03",
    "ends_on": null
  },
  "notes": null
}
