{
  "schema_version": 1,
  "reservations": [
    {
      "kind": "flight",
      "title": "Paris to Montreal",
      "provider": "Air France",
      "booking_ref": "7VT9MR",
      "status": "confirmed",
      "starts_at_local": "2027-07-08T13:35:00",
      "ends_at_local": "2027-07-08T15:20:00",
      "start_place": {
        "name": "Paris-Charles de Gaulle",
        "address": null,
        "iata": "CDG",
        "city": "Paris",
        "country": "FR"
      },
      "end_place": {
        "name": "Montréal-Trudeau",
        "address": null,
        "iata": "YUL",
        "city": "Montreal",
        "country": "CA"
      },
      "travellers": [
        { "name": "Quentin Dumont", "type": "adult" }
      ],
      "price": { "amount": "689.43", "currency": "EUR" },
      "cancellation": "Modification : possible avec frais de 100 EUR, plus une éventuelle différence tarifaire. Annulation : remboursable avant le départ avec des frais de 150 EUR. Après le départ, seules les taxes non utilisées sont remboursables.",
      "details": {
        "number": "AF 344",
        "carrier": "Air France",
        "from_iata": "CDG",
        "to_iata": "YUL",
        "seat": "34K",
        "cabin": "Economy",
        "terminal": "2E",
        "gate": null,
        "legs": null
      },
      "confidence": {
        "kind": 1.0,
        "title": 1.0,
        "provider": 1.0,
        "booking_ref": 1.0,
        "status": 1.0,
        "starts_at_local": 1.0,
        "ends_at_local": 1.0,
        "start_place": 1.0,
        "end_place": 1.0,
        "travellers": 1.0,
        "price": 1.0,
        "cancellation": 1.0,
        "details": 1.0
      }
    }
  ],
  "trip_hint": {
    "destination": "Montreal",
    "country": "CA",
    "starts_on": "2027-07-08",
    "ends_on": null
  },
  "notes": null
}
