{
  "schema_version": 1,
  "reservations": [
    {
      "kind": "lodging",
      "title": "Mercure Lyon Centre Quai Saint-Antoine",
      "provider": "Accor",
      "booking_ref": "2XR5T9CJ",
      "status": "confirmed",
      "starts_at_local": "2027-05-23T15:00:00",
      "ends_at_local": "2027-05-25T12:00:00",
      "start_place": {
        "name": "Mercure Lyon Centre Quai Saint-Antoine",
        "address": "21 quai Saint-Antoine, 69002 Lyon, France",
        "iata": null,
        "city": "Lyon",
        "country": "FR"
      },
      "end_place": null,
      "travellers": [
        { "name": "Quentin Dumont", "type": null }
      ],
      "price": { "amount": "304.40", "currency": "EUR" },
      "cancellation": "Annulation gratuite jusqu'au 22/05/2027 à 12h00 (heure locale de l'hôtel). Au-delà de ce délai, ou en cas de non-présentation, la première nuit sera facturée.",
      "details": {
        "room": "Chambre Privilège avec 1 lit double",
        "guests": 2,
        "address": "21 quai Saint-Antoine, 69002 Lyon, France",
        "phone": "+33 4 78 92 31 40",
        "checkin_time": "15:00",
        "checkout_time": "12:00"
      },
      "confidence": {
        "kind": 1.0,
        "title": 1.0,
        "provider": 1.0,
        "booking_ref": 1.0,
        "status": 1.0,
        "starts_at_local": 1.0,
        "ends_at_local": 1.0,
        "start_place": 1.0,
        "travellers": 1.0,
        "price": 1.0,
        "cancellation": 1.0,
        "details": 1.0
      }
    }
  ],
  "trip_hint": {
    "destination": "Lyon",
    "country": "FR",
    "starts_on": "2027-05-23",
    "ends_on": "2027-05-25"
  },
  "notes": "Payment is made at the hotel; the card only guarantees the reservation. Breakfast is included in the rate."
}
