{
  "schema_version": 1,
  "reservations": [
    {
      "kind": "flight",
      "title": "London to Edinburgh",
      "provider": "British Airways",
      "booking_ref": "TL0Y5K",
      "status": "confirmed",
      "starts_at_local": "2027-09-17T07:15:00",
      "ends_at_local": "2027-09-17T08:35:00",
      "start_place": {
        "name": "London Heathrow",
        "address": null,
        "iata": "LHR",
        "city": "London",
        "country": "GB"
      },
      "end_place": {
        "name": null,
        "address": null,
        "iata": "EDI",
        "city": "Edinburgh",
        "country": "GB"
      },
      "travellers": [
        { "name": "Zofia Kowalczyk", "type": "adult" }
      ],
      "price": null,
      "cancellation": "Changes: Changes to your booking are permitted before departure. A change fee may apply, plus any difference in fare. Cancellations: This ticket is non-refundable. If you do not travel, you can claim back the government taxes, fees and charges.",
      "details": {
        "number": "BA 1436",
        "carrier": "British Airways",
        "from_iata": "LHR",
        "to_iata": "EDI",
        "seat": null,
        "cabin": "Euro Traveller",
        "terminal": "5",
        "gate": null,
        "legs": null
      },
      "confidence": {
        "kind": 1.0,
        "title": 1.0,
        "provider": 1.0,
        "booking_ref": 1.0,
        "status": 1.0,
        "starts_at_local": 1.0,
        "ends_at_local": 1.0,
        "start_place": 1.0,
        "end_place": 1.0,
        "travellers": 1.0,
        "cancellation": 1.0,
        "details": 1.0
      }
    },
    {
      "kind": "flight",
      "title": "Edinburgh to London",
      "provider": "British Airways",
      "booking_ref": "TL0Y5K",
      "status": "confirmed",
      "starts_at_local": "2027-09-19T18:40:00",
      "ends_at_local": "2027-09-19T20:15:00",
      "start_place": {
        "name": null,
        "address": null,
        "iata": "EDI",
        "city": "Edinburgh",
        "country": "GB"
      },
      "end_place": {
        "name": "London Heathrow",
        "address": null,
        "iata": "LHR",
        "city": "London",
        "country": "GB"
      },
      "travellers": [
        { "name": "Zofia Kowalczyk", "type": "adult" }
      ],
      "price": null,
      "cancellation": "Changes: Changes to your booking are permitted before departure. A change fee may apply, plus any difference in fare. Cancellations: This ticket is non-refundable. If you do not travel, you can claim back the government taxes, fees and charges.",
      "details": {
        "number": "BA 1449",
        "carrier": "British Airways",
        "from_iata": "EDI",
        "to_iata": "LHR",
        "seat": null,
        "cabin": "Euro Traveller",
        "terminal": null,
        "gate": null,
        "legs": null
      },
      "confidence": {
        "kind": 1.0,
        "title": 1.0,
        "provider": 1.0,
        "booking_ref": 1.0,
        "status": 1.0,
        "starts_at_local": 1.0,
        "ends_at_local": 1.0,
        "start_place": 1.0,
        "end_place": 1.0,
        "travellers": 1.0,
        "cancellation": 1.0,
        "details": 1.0
      }
    }
  ],
  "trip_hint": {
    "destination": "Edinburgh",
    "country": "GB",
    "starts_on": "2027-09-17",
    "ends_on": "2027-09-19"
  },
  "notes": "The total of £214.60 covers both flights."
}
