{
  "schema_version": 1,
  "reservations": [
    {
      "kind": "transfer",
      "title": "Transfer from Athens International Airport to Ermou Heritage Suites",
      "provider": "Welcome Pickups",
      "booking_ref": "6257977",
      "status": "confirmed",
      "starts_at_local": "2027-07-02T14:35:00",
      "ends_at_local": null,
      "start_place": {
        "name": "Athens International Airport",
        "address": null,
        "iata": "ATH",
        "city": "Athens",
        "country": "GR"
      },
      "end_place": {
        "name": "Ermou Heritage Suites",
        "address": "Ermou 54, Athina 105 63",
        "iata": null,
        "city": "Athens",
        "country": "GR"
      },
      "travellers": [
        { "name": "Fenna Verhoeven", "type": null }
      ],
      "price": { "amount": "45.00", "currency": "EUR" },
      "cancellation": "Free cancellation up to 24 hours before your pickup time. Cancellations made within 24 hours of the pickup are non-refundable.",
      "details": {
        "vehicle": "Standard Sedan",
        "driver_contact": "Teodor Petrakis, +30 694 812 5537"
      },
      "confidence": {
        "kind": 1.0,
        "title": 1.0,
        "provider": 1.0,
        "booking_ref": 1.0,
        "status": 1.0,
        "starts_at_local": 1.0,
        "start_place": 1.0,
        "end_place": 1.0,
        "travellers": 1.0,
        "price": 1.0,
        "cancellation": 1.0,
        "details": 1.0
      }
    }
  ],
  "trip_hint": {
    "destination": "Athens",
    "country": "GR",
    "starts_on": "2027-07-02",
    "ends_on": null
  },
  "notes": "Pick-up is tied to arriving flight A3 601 from London Heathrow; the driver tracks the flight and waits up to 60 minutes after landing."
}
