{
  "schema_version": 1,
  "reservations": [
    {
      "kind": "car_rental",
      "title": "Car rental in Málaga",
      "provider": "Rentalcars.com",
      "booking_ref": "64764197AV4",
      "status": "confirmed",
      "starts_at_local": "2027-06-08T11:00:00",
      "ends_at_local": "2027-06-12T17:00:00",
      "start_place": {
        "name": "Málaga Airport",
        "address": "Avenida del Comandante García Morato, s/n, 29004 Málaga",
        "iata": "AGP",
        "city": "Málaga",
        "country": "ES"
      },
      "end_place": {
        "name": "Seville Santa Justa Train Station",
        "address": "Avenida de Kansas City, s/n, 41007 Sevilla",
        "iata": null,
        "city": "Seville",
        "country": "ES"
      },
      "travellers": [
        { "name": "Elena Duarte", "type": null }
      ],
      "price": { "amount": "325.85", "currency": "EUR" },
      "cancellation": "Free cancellation up to 48 hours before pick-up. If you cancel less than 48 hours before pick-up, you will be refunded the price you paid minus the cost of 3 days' rental. There is no refund for no-shows or for unused rental days.",
      "details": {
        "vehicle": "Peugeot 2008 or similar",
        "pickup": "The Avis desk is in the Arrivals hall of Terminal 3, Level 0. After completing the paperwork, collect your car from car park P2, Level 0.",
        "dropoff": "Return the car to the Avis bays in the station's underground car park, Level -1, and hand in the keys at the Avis office in the station's main hall."
      },
      "confidence": {
        "kind": 1.0,
        "title": 1.0,
        "provider": 1.0,
        "booking_ref": 1.0,
        "status": 1.0,
        "starts_at_local": 1.0,
        "ends_at_local": 1.0,
        "start_place": 1.0,
        "end_place": 1.0,
        "travellers": 1.0,
        "price": 1.0,
        "cancellation": 1.0,
        "details": 1.0
      }
    }
  ],
  "trip_hint": {
    "destination": "Málaga",
    "country": "ES",
    "starts_on": "2027-06-08",
    "ends_on": "2027-06-12"
  },
  "notes": "Supplier is Avis; Rentalcars.com booking reference 337289992. One-way rental from Málaga Airport to Seville Santa Justa, one-way fee included."
}
