{
  "schema_version": 1,
  "reservations": [
    {
      "kind": "dining",
      "title": "Dinner at Sushi Yamato",
      "provider": "TableCheck",
      "booking_ref": "CC4P1LM2",
      "status": "confirmed",
      "starts_at_local": "2027-11-06T18:00:00",
      "ends_at_local": null,
      "start_place": {
        "name": "鮨 やまと",
        "address": "東京都港区西麻布2-14-7 B1F",
        "iata": null,
        "city": "Tokyo",
        "country": "JP"
      },
      "end_place": null,
      "travellers": [
        { "name": "Mei Nakamura", "type": null }
      ],
      "price": { "amount": "57200", "currency": "JPY" },
      "cancellation": "ご予約日の2日前までのキャンセルは無料です。前日のキャンセルはコース料金の50%、当日および無断のキャンセルはコース料金の100%を頂戴いたします。",
      "details": {
        "party_size": 2,
        "phone": "03-5468-2219"
      },
      "confidence": {
        "kind": 1.0,
        "title": 1.0,
        "provider": 1.0,
        "booking_ref": 1.0,
        "status": 1.0,
        "starts_at_local": 1.0,
        "start_place": 1.0,
        "travellers": 1.0,
        "price": 1.0,
        "cancellation": 1.0,
        "details": 1.0
      }
    }
  ],
  "trip_hint": {
    "destination": "Tokyo",
    "country": "JP",
    "starts_on": "2027-11-06",
    "ends_on": "2027-11-06"
  },
  "notes": "Prepaid omakase course for 2 at ¥28,600 per person; drinks are paid at the restaurant."
}
