{
  "schema_version": 1,
  "reservations": [
    {
      "kind": "transfer",
      "title": "Transfer from Hotel Am Schottenring to Vienna International Airport",
      "provider": "Blacklane",
      "booking_ref": "ZS2N1AF6",
      "status": "confirmed",
      "starts_at_local": "2027-12-15T06:15:00",
      "ends_at_local": null,
      "start_place": {
        "name": "Hotel Am Schottenring",
        "address": "Schottenring 18, 1010 Vienna, Austria",
        "iata": null,
        "city": "Vienna",
        "country": "AT"
      },
      "end_place": {
        "name": "Vienna International Airport",
        "address": null,
        "iata": "VIE",
        "city": "Vienna",
        "country": "AT"
      },
      "travellers": [
        { "name": "Saskia Weissmann", "type": null }
      ],
      "price": { "amount": "79.00", "currency": "EUR" },
      "cancellation": "You can cancel this ride free of charge up to 1 hour before the scheduled pickup time. Later cancellations and no-shows are charged in full.",
      "details": {
        "vehicle": "Business Class (Mercedes-Benz E-Class or similar)",
        "driver_contact": "Tomas Novak, +43 664 382 7145"
      },
      "confidence": {
        "kind": 1.0,
        "title": 1.0,
        "provider": 1.0,
        "booking_ref": 1.0,
        "status": 1.0,
        "starts_at_local": 1.0,
        "start_place": 1.0,
        "end_place": 1.0,
        "travellers": 1.0,
        "price": 1.0,
        "cancellation": 1.0,
        "details": 1.0
      }
    }
  ],
  "trip_hint": {
    "destination": "Vienna",
    "country": "AT",
    "starts_on": "2027-12-15",
    "ends_on": null
  },
  "notes": "Drop-off at Terminal 3 departures for flight OS 127 to Frankfurt at 08:10."
}
